"Status","Start Time","Stop Time","Duration in ms","Parent Suite","Suite","Sub Suite","Test Class","Test Method","Name","Description"
"passed","Thu Sep 30 11:20:24 GMT 2021","Thu Sep 30 11:20:24 GMT 2021","1","","","","","","Create new label for authorized user",""
"passed","Thu Sep 30 11:20:26 GMT 2021","Thu Sep 30 11:20:26 GMT 2021","1","","","","","","Close existing milestone for authorized user",""
"passed","Thu Sep 30 11:20:24 GMT 2021","Thu Sep 30 11:20:24 GMT 2021","2","","","","","","Create new label via api",""
"passed","Thu Sep 30 11:20:26 GMT 2021","Thu Sep 30 11:20:26 GMT 2021","1","","","","","","Create new milestone for authorized user",""
"passed","Thu Sep 30 11:20:24 GMT 2021","Thu Sep 30 11:20:25 GMT 2021","1002","","","","","","Add label to existing issue for authorized user",""
"passed","Thu Sep 30 11:20:24 GMT 2021","Thu Sep 30 11:20:24 GMT 2021","1","","","","","","Delete existing label via api",""
"failed","Thu Sep 30 11:20:25 GMT 2021","Thu Sep 30 11:20:26 GMT 2021","1004","","","","","","Delete existing label for authorized user",""
